{
 "versao": 1,
 "id": "television_valutech",
 "nota": "TV de tubo pequena: corpo da frente cinza com moldura e tela escura opaca, traseira em tronco que afina para tras (prisma) com relevo central traseiro, base preta chanfrada atras com 3 luzinhas coloridas, grade lateral com 3 frisos. Frente em -y, tras em +y.",
 "sprites": {
  "S": "appliances_television_01_4",
  "E": "appliances_television_01_5",
  "N": "appliances_television_01_6",
  "W": "appliances_television_01_7"
 },
 "tras": "N",
 "material": "liso",
 "pecas": [
  {
   "nome": "corpo_frente",
   "forma": "caixa",
   "min": [
    -0.4103,
    -0.1101,
    0.3828
   ],
   "max": [
    0.3233,
    -0.02,
    1.0218
   ],
   "chanfro": 0.012
  },
  {
   "nome": "moldura",
   "forma": "caixa",
   "min": [
    -0.4003,
    -0.1181,
    0.3928
   ],
   "max": [
    0.3133,
    -0.1101,
    1.0118
   ],
   "chanfro": 0.004
  },
  {
   "nome": "tela",
   "forma": "caixa",
   "min": [
    -0.37,
    -0.1241,
    0.51
   ],
   "max": [
    0.22,
    -0.1181,
    0.935
   ],
   "material": "tela",
   "chanfro": 0.015
  },
  {
   "nome": "entrada_fita",
   "forma": "caixa",
   "min": [
    -0.27,
    -0.1211,
    0.43
   ],
   "max": [
    0.03,
    -0.1181,
    0.48
   ],
   "material": "tela",
   "chanfro": 0.002
  },
  {
   "nome": "botao_a",
   "forma": "caixa",
   "min": [
    0.1,
    -0.1241,
    0.43
   ],
   "max": [
    0.12,
    -0.1181,
    0.45
   ],
   "material": "botao"
  },
  {
   "nome": "botao_b",
   "forma": "caixa",
   "min": [
    0.15,
    -0.1241,
    0.43
   ],
   "max": [
    0.17,
    -0.1181,
    0.45
   ],
   "material": "botao"
  },
  {
   "nome": "traseira",
   "forma": "prisma",
   "perfil": [
    [
     -0.35,
     0.62
    ],
    [
     0.318,
     0.62
    ],
    [
     0.318,
     0.86
    ],
    [
     0.24,
     1.005
    ],
    [
     -0.26,
     1.005
    ],
    [
     -0.35,
     0.86
    ]
   ],
   "eixo": "y",
   "de": -0.04,
   "ate": 0.22,
   "chanfro": 0.01
  },
  {
   "nome": "traseira_relevo",
   "forma": "caixa",
   "min": [
    -0.15,
    0.215,
    0.62
   ],
   "max": [
    0.11,
    0.245,
    0.84
   ],
   "material": "liso_escuro",
   "chanfro": 0.006
  },
  {
   "nome": "base_escura",
   "forma": "prisma",
   "perfil": [
    [
     -0.03,
     0.3828
    ],
    [
     0.18,
     0.3828
    ],
    [
     0.22,
     0.43
    ],
    [
     0.22,
     0.6
    ],
    [
     0.18,
     0.63
    ],
    [
     -0.03,
     0.63
    ]
   ],
   "eixo": "x",
   "de": -0.35,
   "ate": 0.318,
   "material": "preto"
  },
  {
   "nome": "luz_amarela",
   "forma": "caixa",
   "min": [
    -0.23,
    0.215,
    0.525
   ],
   "max": [
    -0.2,
    0.23,
    0.55
   ],
   "material": "luz_amarela",
   "chanfro": 0.002
  },
  {
   "nome": "luz_branca",
   "forma": "caixa",
   "min": [
    -0.23,
    0.215,
    0.475
   ],
   "max": [
    -0.2,
    0.23,
    0.5
   ],
   "material": "luz_branca",
   "chanfro": 0.002
  },
  {
   "nome": "luz_vermelha",
   "forma": "caixa",
   "min": [
    -0.23,
    0.215,
    0.425
   ],
   "max": [
    -0.2,
    0.23,
    0.45
   ],
   "material": "luz_vermelha",
   "chanfro": 0.002
  },
  {
   "nome": "grade_lateral",
   "forma": "caixa",
   "min": [
    0.313,
    0.07,
    0.65
   ],
   "max": [
    0.322,
    0.19,
    0.77
   ],
   "material": "grade",
   "chanfro": 0.002
  },
  {
   "nome": "grade_friso_1",
   "forma": "caixa",
   "min": [
    0.318,
    0.085,
    0.735
   ],
   "max": [
    0.326,
    0.175,
    0.75
   ],
   "material": "fresta",
   "chanfro": 0.001
  },
  {
   "nome": "grade_friso_2",
   "forma": "caixa",
   "min": [
    0.318,
    0.085,
    0.7
   ],
   "max": [
    0.326,
    0.175,
    0.715
   ],
   "material": "fresta",
   "chanfro": 0.001
  },
  {
   "nome": "grade_friso_3",
   "forma": "caixa",
   "min": [
    0.318,
    0.085,
    0.665
   ],
   "max": [
    0.326,
    0.175,
    0.68
   ],
   "material": "fresta",
   "chanfro": 0.001
  }
 ],
 "arte": {
  "modo": "adesivo"
 },
 "realista": {
  "materiais": {
   "liso": {
    "tipo": "liso",
    "desgaste": 0.25
   },
   "liso_escuro": {
    "tipo": "liso",
    "desgaste": 0.25
   },
   "tela": {
    "tipo": "liso",
    "desgaste": 0.15
   },
   "botao": {
    "tipo": "liso"
   },
   "preto": {
    "tipo": "liso",
    "desgaste": 0.2
   },
   "grade": {
    "tipo": "liso",
    "desgaste": 0.25
   },
   "fresta": {
    "tipo": "liso"
   },
   "luz_amarela": {
    "tipo": "liso"
   },
   "luz_branca": {
    "tipo": "liso"
   },
   "luz_vermelha": {
    "tipo": "liso"
   }
  }
 },
 "cores": {
  "liso": [
   115,
   115,
   120
  ],
  "liso_escuro": [
   95,
   95,
   100
  ],
  "tela": [
   24,
   26,
   28
  ],
  "botao": [
   16,
   16,
   18
  ],
  "preto": [
   30,
   30,
   33
  ],
  "grade": [
   82,
   82,
   86
  ],
  "fresta": [
   22,
   22,
   25
  ],
  "luz_amarela": [
   165,
   150,
   65
  ],
  "luz_branca": [
   200,
   200,
   205
  ],
  "luz_vermelha": [
   160,
   50,
   45
  ]
 }
}
