{
 "versao": 1,
 "id": "oven_green",
 "sprites": {
  "S": "appliances_cooking_01_1",
  "E": "appliances_cooking_01_0",
  "N": "appliances_cooking_01_3",
  "W": "appliances_cooking_01_2"
 },
 "tras": "N",
 "material": "liso",
 "cores": {
  "escuro": [
   52,
   56,
   52
  ],
  "vidro": [
   18,
   20,
   22
  ],
  "cromado": [
   200,
   200,
   194
  ],
  "cinza": [
   104,
   106,
   104
  ],
  "furo": [
   12,
   12,
   12
  ],
  "liso": [
   152,
   182,
   150
  ],
  "moldura": [
   176,
   186,
   176
  ],
  "anel": [
   196,
   204,
   194
  ]
 },
 "pecas": [
  {
   "nome": "corpo",
   "forma": "caixa",
   "min": [
    -0.47,
    -0.19,
    0.05
   ],
   "max": [
    0.44,
    0.44,
    0.901
   ],
   "chanfro": 0.012
  },
  {
   "nome": "rodape",
   "forma": "caixa",
   "min": [
    -0.44499999999999995,
    -0.165,
    0.0
   ],
   "max": [
    0.415,
    0.415,
    0.06
   ],
   "material": "escuro",
   "chanfro": 0.004
  },
  {
   "nome": "painel_traseiro",
   "forma": "prisma",
   "eixo": "y",
   "de": 0.295,
   "ate": 0.44,
   "chanfro": 0.006,
   "perfil": [
    [
     -0.455,
     0.899
    ],
    [
     -0.455,
     0.95
    ],
    [
     -0.3431,
     0.985
    ],
    [
     -0.2313,
     1.01
    ],
    [
     -0.1194,
     1.025
    ],
    [
     -0.0075,
     1.03
    ],
    [
     0.1044,
     1.025
    ],
    [
     0.2162,
     1.01
    ],
    [
     0.3281,
     0.985
    ],
    [
     0.44,
     0.95
    ],
    [
     0.44,
     0.899
    ]
   ]
  },
  {
   "nome": "queimador1",
   "forma": "cilindro",
   "centro": [
    -0.34,
    -0.06,
    0.899
   ],
   "raio": 0.085,
   "altura": 0.014,
   "material": "escuro",
   "segmentos": 28
  },
  {
   "nome": "anel_queimador1",
   "forma": "cilindro",
   "centro": [
    -0.34,
    -0.06,
    0.899
   ],
   "raio": 0.101,
   "altura": 0.012,
   "material": "anel",
   "segmentos": 28
  },
  {
   "nome": "grelha_queimador1a",
   "forma": "caixa",
   "min": [
    -0.41500000000000004,
    -0.067,
    0.913
   ],
   "max": [
    -0.265,
    -0.053,
    0.92
   ],
   "material": "escuro"
  },
  {
   "nome": "grelha_queimador1b",
   "forma": "caixa",
   "min": [
    -0.34700000000000003,
    -0.135,
    0.913
   ],
   "max": [
    -0.333,
    0.015000000000000013,
    0.92
   ],
   "material": "escuro"
  },
  {
   "nome": "queimador2",
   "forma": "cilindro",
   "centro": [
    -0.19,
    0.18,
    0.899
   ],
   "raio": 0.075,
   "altura": 0.014,
   "material": "escuro",
   "segmentos": 28
  },
  {
   "nome": "anel_queimador2",
   "forma": "cilindro",
   "centro": [
    -0.19,
    0.18,
    0.899
   ],
   "raio": 0.091,
   "altura": 0.012,
   "material": "anel",
   "segmentos": 28
  },
  {
   "nome": "grelha_queimador2a",
   "forma": "caixa",
   "min": [
    -0.255,
    0.173,
    0.913
   ],
   "max": [
    -0.125,
    0.187,
    0.92
   ],
   "material": "escuro"
  },
  {
   "nome": "grelha_queimador2b",
   "forma": "caixa",
   "min": [
    -0.197,
    0.11499999999999999,
    0.913
   ],
   "max": [
    -0.183,
    0.245,
    0.92
   ],
   "material": "escuro"
  },
  {
   "nome": "queimador3",
   "forma": "cilindro",
   "centro": [
    0.09,
    0.21,
    0.899
   ],
   "raio": 0.07,
   "altura": 0.014,
   "material": "escuro",
   "segmentos": 28
  },
  {
   "nome": "anel_queimador3",
   "forma": "cilindro",
   "centro": [
    0.09,
    0.21,
    0.899
   ],
   "raio": 0.086,
   "altura": 0.012,
   "material": "anel",
   "segmentos": 28
  },
  {
   "nome": "grelha_queimador3a",
   "forma": "caixa",
   "min": [
    0.029999999999999992,
    0.20299999999999999,
    0.913
   ],
   "max": [
    0.15,
    0.217,
    0.92
   ],
   "material": "escuro"
  },
  {
   "nome": "grelha_queimador3b",
   "forma": "caixa",
   "min": [
    0.08299999999999999,
    0.15,
    0.913
   ],
   "max": [
    0.097,
    0.27,
    0.92
   ],
   "material": "escuro"
  },
  {
   "nome": "queimador4",
   "forma": "cilindro",
   "centro": [
    0.29,
    -0.05,
    0.899
   ],
   "raio": 0.1,
   "altura": 0.014,
   "material": "escuro",
   "segmentos": 28
  },
  {
   "nome": "anel_queimador4",
   "forma": "cilindro",
   "centro": [
    0.29,
    -0.05,
    0.899
   ],
   "raio": 0.116,
   "altura": 0.012,
   "material": "anel",
   "segmentos": 28
  },
  {
   "nome": "grelha_queimador4a",
   "forma": "caixa",
   "min": [
    0.19999999999999996,
    -0.057,
    0.913
   ],
   "max": [
    0.38,
    -0.043000000000000003,
    0.92
   ],
   "material": "escuro"
  },
  {
   "nome": "grelha_queimador4b",
   "forma": "caixa",
   "min": [
    0.283,
    -0.14,
    0.913
   ],
   "max": [
    0.297,
    0.04000000000000001,
    0.92
   ],
   "material": "escuro"
  },
  {
   "nome": "porta_forno",
   "forma": "caixa",
   "min": [
    -0.44,
    -0.212,
    0.14
   ],
   "max": [
    0.35,
    -0.19,
    0.6
   ],
   "chanfro": 0.008,
   "material": "moldura"
  },
  {
   "nome": "visor_forno",
   "forma": "caixa",
   "min": [
    -0.33,
    -0.216,
    0.185
   ],
   "max": [
    0.3,
    -0.21,
    0.545
   ],
   "material": "vidro",
   "chanfro": 0.002
  },
  {
   "nome": "puxador_forno",
   "forma": "cilindro",
   "centro": [
    -0.345,
    -0.245,
    0.64
   ],
   "raio": 0.011,
   "altura": 0.66,
   "material": "cromado",
   "eixo": "x",
   "segmentos": 14
  },
  {
   "nome": "puxador_apoio_a",
   "forma": "caixa",
   "min": [
    -0.33499999999999996,
    -0.245,
    0.625
   ],
   "max": [
    -0.31499999999999995,
    -0.208,
    0.655
   ],
   "material": "cromado",
   "chanfro": 0.002
  },
  {
   "nome": "puxador_apoio_b",
   "forma": "caixa",
   "min": [
    0.28500000000000003,
    -0.245,
    0.625
   ],
   "max": [
    0.30500000000000005,
    -0.208,
    0.655
   ],
   "material": "cromado",
   "chanfro": 0.002
  },
  {
   "nome": "friso_cromado_alto",
   "forma": "caixa",
   "min": [
    -0.475,
    -0.195,
    0.68
   ],
   "max": [
    0.445,
    0.442,
    0.7
   ],
   "material": "cromado",
   "chanfro": 0.004
  },
  {
   "nome": "friso_cromado_baixo",
   "forma": "caixa",
   "min": [
    -0.475,
    -0.195,
    0.09
   ],
   "max": [
    0.445,
    0.442,
    0.11
   ],
   "material": "cromado",
   "chanfro": 0.004
  },
  {
   "nome": "botao1",
   "forma": "cilindro",
   "centro": [
    -0.365,
    -0.212,
    0.77
   ],
   "raio": 0.02,
   "altura": 0.04,
   "material": "cromado",
   "eixo": "y",
   "segmentos": 16
  },
  {
   "nome": "botao2",
   "forma": "cilindro",
   "centro": [
    -0.22499999999999998,
    -0.212,
    0.77
   ],
   "raio": 0.02,
   "altura": 0.04,
   "material": "cromado",
   "eixo": "y",
   "segmentos": 16
  },
  {
   "nome": "botao3",
   "forma": "cilindro",
   "centro": [
    -0.08499999999999996,
    -0.212,
    0.77
   ],
   "raio": 0.02,
   "altura": 0.04,
   "material": "cromado",
   "eixo": "y",
   "segmentos": 16
  },
  {
   "nome": "botao4",
   "forma": "cilindro",
   "centro": [
    0.05500000000000005,
    -0.212,
    0.77
   ],
   "raio": 0.02,
   "altura": 0.04,
   "material": "cromado",
   "eixo": "y",
   "segmentos": 16
  },
  {
   "nome": "botao5",
   "forma": "cilindro",
   "centro": [
    0.19500000000000006,
    -0.212,
    0.77
   ],
   "raio": 0.02,
   "altura": 0.04,
   "material": "cromado",
   "eixo": "y",
   "segmentos": 16
  },
  {
   "nome": "botao6",
   "forma": "cilindro",
   "centro": [
    0.3350000000000001,
    -0.212,
    0.77
   ],
   "raio": 0.02,
   "altura": 0.04,
   "material": "cromado",
   "eixo": "y",
   "segmentos": 16
  },
  {
   "nome": "tampa_traseira",
   "forma": "caixa",
   "min": [
    -0.375,
    0.44,
    0.07
   ],
   "max": [
    0.345,
    0.452,
    0.66
   ],
   "material": "cinza",
   "chanfro": 0.003
  },
  {
   "nome": "furo_tampa",
   "forma": "cilindro",
   "centro": [
    0.255,
    0.451,
    0.45
   ],
   "raio": 0.025,
   "altura": 0.003,
   "material": "furo",
   "eixo": "y",
   "segmentos": 20
  },
  {
   "nome": "grelha_ventilacao_a",
   "forma": "caixa",
   "min": [
    0.08500000000000002,
    0.452,
    0.14
   ],
   "max": [
    0.32500000000000007,
    0.456,
    0.27
   ],
   "material": "cinza"
  },
  {
   "nome": "grelha_ventilacao_b",
   "forma": "caixa",
   "min": [
    -0.235,
    0.452,
    0.14
   ],
   "max": [
    0.015000000000000013,
    0.456,
    0.27
   ],
   "material": "cinza"
  }
 ],
 "arte": {
  "modo": "adesivo"
 },
 "realista": {
  "materiais": {
   "liso": {
    "tipo": "liso",
    "desgaste": 0.4
   },
   "metal": {
    "tipo": "metal"
   },
   "escuro": {
    "tipo": "metal",
    "desgaste": 0.3
   },
   "vidro": {
    "tipo": "liso"
   },
   "cromado": {
    "tipo": "metal"
   },
   "cinza": {
    "tipo": "metal",
    "desgaste": 0.3
   },
   "furo": {
    "tipo": "liso"
   },
   "moldura": {
    "tipo": "metal",
    "desgaste": 0.2
   },
   "anel": {
    "tipo": "metal"
   }
  }
 }
}
