{
 "versao": 1,
 "id": "counter_dark_bar_corner",
 "sprites": {
  "S": "location_restaurant_bar_01_20",
  "E": "location_restaurant_bar_01_22",
  "N": "location_restaurant_bar_01_16",
  "W": "location_restaurant_bar_01_18"
 },
 "tras": "N",
 "material": "liso",
 "pecas": [
  {
   "nome": "corpo_longo",
   "forma": "caixa",
   "min": [
    -0.45,
    -0.115,
    0.1
   ],
   "max": [
    0.5,
    0.45,
    1.1
   ],
   "chanfro": 0.005
  },
  {
   "nome": "corpo_curto",
   "forma": "caixa",
   "min": [
    -0.45,
    -0.5,
    0.1
   ],
   "max": [
    0.095,
    -0.115,
    1.1
   ],
   "chanfro": 0.005
  },
  {
   "nome": "tampo_longo",
   "forma": "caixa",
   "min": [
    -0.45,
    -0.13,
    1.1
   ],
   "max": [
    0.5,
    0.45,
    1.2
   ],
   "chanfro": 0.005
  },
  {
   "nome": "tampo_curto",
   "forma": "caixa",
   "min": [
    -0.45,
    -0.5,
    1.1
   ],
   "max": [
    0.11,
    -0.13,
    1.2
   ],
   "chanfro": 0.005
  },
  {
   "nome": "rodape_longo",
   "forma": "caixa",
   "min": [
    -0.45,
    -0.13,
    0.0
   ],
   "max": [
    0.5,
    0.45,
    0.1
   ],
   "chanfro": 0.005
  },
  {
   "nome": "rodape_curto",
   "forma": "caixa",
   "min": [
    -0.45,
    -0.5,
    0.0
   ],
   "max": [
    0.11,
    -0.13,
    0.1
   ],
   "chanfro": 0.005
  }
 ],
 "arte": {
  "modo": "adesivo"
 }
}
