{
 "versao": 1,
 "id": "deluxe_espresso",
 "sprites": {
  "S": "appliances_cooking_01_61",
  "E": "appliances_cooking_01_60",
  "N": "appliances_cooking_01_62",
  "W": "appliances_cooking_01_63"
 },
 "tras": "N",
 "material": "metal",
 "cores": {
  "metal": [
   110,
   112,
   115
  ],
  "metal_escuro": [
   60,
   62,
   65
  ],
  "painel_escuro": [
   42,
   42,
   45
  ],
  "liso": [
   228,
   230,
   232
  ],
  "cromado": [
   185,
   188,
   190
  ],
  "mostrador_claro": [
   220,
   215,
   215
  ],
  "marrom_graos": [
   115,
   75,
   38
  ],
  "cinza_tampa": [
   140,
   142,
   145
  ]
 },
 "pecas": [
  {
   "nome": "bandeja",
   "forma": "caixa",
   "material": "metal_escuro",
   "min": [
    -0.465,
    -0.04,
    0.865
   ],
   "max": [
    0.405,
    0.265,
    0.925
   ],
   "chanfro": 0.005
  },
  {
   "nome": "grade_bandeja",
   "forma": "caixa",
   "material": "cromado",
   "min": [
    -0.425,
    -0.01,
    0.925
   ],
   "max": [
    0.365,
    0.245,
    0.935
   ],
   "chanfro": 0.002
  },
  {
   "nome": "coluna_traseira",
   "forma": "caixa",
   "material": "metal",
   "min": [
    -0.465,
    0.265,
    0.865
   ],
   "max": [
    0.405,
    0.405,
    1.325
   ],
   "chanfro": 0.006
  },
  {
   "nome": "cabeca",
   "forma": "caixa",
   "material": "metal_escuro",
   "min": [
    -0.465,
    -0.04,
    1.325
   ],
   "max": [
    0.405,
    0.405,
    1.52
   ],
   "chanfro": 0.008
  },
  {
   "nome": "bloco_esquerdo",
   "forma": "caixa",
   "material": "painel_escuro",
   "min": [
    -0.468,
    -0.048,
    1.33
   ],
   "max": [
    -0.02,
    0.14,
    1.515
   ],
   "chanfro": 0.006
  },
  {
   "nome": "tampo",
   "forma": "caixa",
   "material": "liso",
   "min": [
    -0.47,
    -0.045,
    1.52
   ],
   "max": [
    0.41,
    0.41,
    1.558
   ],
   "chanfro": 0.008
  },
  {
   "nome": "moedor_base",
   "forma": "cilindro",
   "material": "marrom_graos",
   "centro": [
    -0.245,
    0.18,
    1.558
   ],
   "raio": 0.072,
   "altura": 0.115,
   "eixo": "z"
  },
  {
   "nome": "moedor_copo",
   "forma": "cilindro",
   "material": "cinza_tampa",
   "centro": [
    -0.245,
    0.18,
    1.645
   ],
   "raio": 0.138,
   "altura": 0.13,
   "eixo": "z"
  },
  {
   "nome": "manometros_1",
   "forma": "cilindro",
   "material": "cromado",
   "centro": [
    -0.3,
    -0.062,
    1.4
   ],
   "raio": 0.042,
   "altura": 0.02,
   "eixo": "y"
  },
  {
   "nome": "manometros_2",
   "forma": "cilindro",
   "material": "cromado",
   "centro": [
    -0.04,
    -0.062,
    1.4
   ],
   "raio": 0.042,
   "altura": 0.02,
   "eixo": "y"
  },
  {
   "nome": "manometros_3",
   "forma": "cilindro",
   "material": "mostrador_claro",
   "centro": [
    0.21,
    -0.062,
    1.4
   ],
   "raio": 0.045,
   "altura": 0.02,
   "eixo": "y"
  },
  {
   "nome": "porta_filtro_1",
   "forma": "cilindro",
   "material": "cromado",
   "centro": [
    -0.3,
    0.03,
    1.22
   ],
   "raio": 0.06,
   "altura": 0.105,
   "eixo": "z"
  },
  {
   "nome": "porta_filtro_cabo_1",
   "forma": "cilindro",
   "material": "painel_escuro",
   "centro": [
    -0.49,
    0.03,
    1.25
   ],
   "raio": 0.02,
   "altura": 0.16,
   "eixo": "x"
  },
  {
   "nome": "porta_filtro_2",
   "forma": "cilindro",
   "material": "cromado",
   "centro": [
    -0.01,
    0.03,
    1.22
   ],
   "raio": 0.06,
   "altura": 0.105,
   "eixo": "z"
  },
  {
   "nome": "porta_filtro_cabo_2",
   "forma": "cilindro",
   "material": "painel_escuro",
   "centro": [
    -0.18,
    0.03,
    1.25
   ],
   "raio": 0.02,
   "altura": 0.14,
   "eixo": "x"
  },
  {
   "nome": "alavanca_vapor",
   "forma": "cilindro",
   "material": "painel_escuro",
   "centro": [
    0.27,
    -0.07,
    1.25
   ],
   "raio": 0.018,
   "altura": 0.24,
   "eixo": "z",
   "rot": [
    0,
    -15,
    0
   ]
  },
  {
   "nome": "alavanca_esquerda",
   "forma": "cilindro",
   "material": "cromado",
   "centro": [
    -0.57,
    0.01,
    1.47
   ],
   "raio": 0.022,
   "altura": 0.11,
   "eixo": "x",
   "rot": [
    0,
    15,
    -20
   ]
  }
 ],
 "arte": {
  "modo": "adesivo"
 },
 "realista": {
  "materiais": {
   "metal": {
    "tipo": "metal",
    "desgaste": 0.3
   },
   "metal_escuro": {
    "tipo": "metal",
    "desgaste": 0.35
   },
   "painel_escuro": {
    "tipo": "metal",
    "desgaste": 0.3
   },
   "liso": {
    "tipo": "liso",
    "desgaste": 0.25
   },
   "cromado": {
    "tipo": "metal",
    "desgaste": 0.15
   },
   "mostrador_claro": {
    "tipo": "liso",
    "desgaste": 0.1
   },
   "marrom_graos": {
    "tipo": "liso",
    "desgaste": 0.3
   },
   "cinza_tampa": {
    "tipo": "metal",
    "desgaste": 0.25
   }
  }
 }
}
